repo,path,sha,date_time,previous_content,content,levenshtein_distance,bcompare
npm/node-tar,SECURITY.md,e0f1eb5189bbaa290659137c8887aefeea56a32d,2022-09-20 22:23:35+00:00,,"Please send vulnerability reports through [hackerone](https://hackerone.com/github).
",85,b npm/node-tar e0f1eb5189bbaa290659137c8887aefeea56a32d
npm/node-tar,SECURITY.md,329caed7d218f1784592f98380ff5a76968141ec,2022-11-12 21:39:06+00:00,"Please send vulnerability reports through [hackerone](https://hackerone.com/github).
","GitHub takes the security of our software products and services seriously, including the open source code repositories managed through our GitHub organizations, such as [GitHub](https://github.com/GitHub).

If you believe you have found a security vulnerability in this GitHub-owned open source repository, you can report it to us in one of two ways. 

If the vulnerability you have found is *not* [in scope for the GitHub Bug Bounty Program](https://bounty.github.com/#scope) or if you do not wish to be considered for a bounty reward, please report the issue to us directly using [private vulnerability reporting](https://docs.github.com/en/code-security/security-advisories/guidance-on-reporting-and-writing/privately-reporting-a-security-vulnerability).

If the vulnerability you have found is [in scope for the GitHub Bug Bounty Program](https://bounty.github.com/#scope) and you would like for your finding to be considered for a bounty reward, please submit the vulnerability to us through [HackerOne](https://hackerone.com/github) in order to be eligible to receive a bounty award.

**Please do not report security vulnerabilities through public GitHub issues, discussions, or pull requests.**

Thanks for helping make GitHub safe for everyone.

",1170,b npm/node-tar 329caed7d218f1784592f98380ff5a76968141ec
