repo,path,sha,date_time,previous_content,content,levenshtein_distance,bcompare
executablebooks/markdown-it-py,SECURITY.md,cf8b2d8c561233d4c18c55e80b68c8d06850fda6,2023-02-22 05:32:13+00:00,,"# Security Policy

## Supported Versions

We generally only support the latest major release,
although critical bug fixes can be released for older versions.

## Reporting a Vulnerability

To report a security issue, please email <executablebooks@gmail.com> with a description of the issue,
the steps you took to create the issue, affected versions, and, if known, mitigations for the issue.
Our team will respond within 3 working days of your email.
If the issue is confirmed as a vulnerability, we will open a Security Advisory.
This project follows a 90 day disclosure timeline.
",582,b executablebooks/markdown-it-py cf8b2d8c561233d4c18c55e80b68c8d06850fda6
